{
  "schemaVersion" : 1,
  "run" : {
    "id" : "ce3fa62f-357d-4e6c-8539-6d26fbea7ab4",
    "command" : "run_query",
    "startedAt" : "2026-07-03T00:11:07.509058Z",
    "range" : {
      "start" : "M",
      "end" : "Mz"
    },
    "bufferSize" : 5,
    "indexed" : true,
    "wallClockMs" : 5
  },
  "summary" : {
    "pagesRead" : 5,
    "bufferHits" : 15,
    "bufferMisses" : 5,
    "evictions" : 3,
    "recordsExamined" : 38,
    "recordsEmitted" : 3,
    "operatorNextCalls" : 38,
    "btreeNodeVisits" : 3
  },
  "plan" : {
    "id" : "project-1",
    "type" : "PROJECT",
    "label" : "Project: title, name",
    "children" : [ {
      "id" : "bnl_join-1",
      "type" : "BNL_JOIN",
      "label" : "BNL Join: personId = personId",
      "children" : [ {
        "id" : "bnl_join-2",
        "type" : "BNL_JOIN",
        "label" : "BNL Join: movieId = movieId",
        "children" : [ {
          "id" : "index_scan-1",
          "type" : "INDEX_SCAN",
          "label" : "Index Scan: movies.db",
          "detail" : "B+ tree range on title.idx",
          "children" : [ ]
        }, {
          "id" : "materialize-1",
          "type" : "MATERIALIZE",
          "label" : "Project: movieId, personId",
          "detail" : "materialized temp file",
          "children" : [ {
            "id" : "selection-1",
            "type" : "SELECTION",
            "label" : "Selection: category = director",
            "children" : [ {
              "id" : "scan-1",
              "type" : "SCAN",
              "label" : "Scan: workedon.db",
              "children" : [ ]
            } ]
          } ]
        } ]
      }, {
        "id" : "scan-2",
        "type" : "SCAN",
        "label" : "Scan: people.db",
        "children" : [ ]
      } ]
    } ]
  },
  "tables" : {
    "workedon.db" : {
      "fileId" : "workedon.db",
      "recordSize" : 39,
      "recordCount" : 5
    },
    "people.db" : {
      "fileId" : "people.db",
      "recordSize" : 115,
      "recordCount" : 5
    },
    "title.idx" : {
      "fileId" : "title.idx",
      "recordSize" : 30
    },
    "movies.db" : {
      "fileId" : "movies.db",
      "recordSize" : 39,
      "recordCount" : 5
    }
  },
  "events" : [ {
    "seq" : 0,
    "timeMs" : 0,
    "type" : "operator.open",
    "operatorId" : "project-1"
  }, {
    "seq" : 1,
    "timeMs" : 1,
    "type" : "operator.open",
    "operatorId" : "bnl_join-1"
  }, {
    "seq" : 2,
    "timeMs" : 2,
    "type" : "operator.open",
    "operatorId" : "bnl_join-2"
  }, {
    "seq" : 3,
    "timeMs" : 3,
    "type" : "operator.open",
    "operatorId" : "index_scan-1"
  }, {
    "seq" : 4,
    "timeMs" : 4,
    "type" : "btree.search_begin",
    "operatorId" : "index_scan-1",
    "btree" : {
      "indexFileId" : "title.idx",
      "rangeStart" : "M",
      "rangeEnd" : "Mz"
    }
  }, {
    "seq" : 5,
    "timeMs" : 5,
    "type" : "buffer.miss",
    "page" : {
      "fileId" : "title.idx",
      "pageId" : 0
    }
  }, {
    "seq" : 6,
    "timeMs" : 6,
    "type" : "buffer.page_load",
    "page" : {
      "fileId" : "title.idx",
      "pageId" : 0
    },
    "frame" : {
      "frameId" : 0,
      "dirty" : false,
      "pinCount" : 1
    }
  }, {
    "seq" : 7,
    "timeMs" : 7,
    "type" : "btree.node_visit",
    "operatorId" : "index_scan-1",
    "page" : {
      "fileId" : "title.idx",
      "pageId" : 0
    },
    "btree" : {
      "indexFileId" : "title.idx",
      "nodePageId" : 0,
      "nodeType" : "INTERNAL"
    }
  }, {
    "seq" : 8,
    "timeMs" : 8,
    "type" : "buffer.miss",
    "page" : {
      "fileId" : "title.idx",
      "pageId" : 1
    }
  }, {
    "seq" : 9,
    "timeMs" : 9,
    "type" : "buffer.page_load",
    "page" : {
      "fileId" : "title.idx",
      "pageId" : 1
    },
    "frame" : {
      "frameId" : 1,
      "dirty" : false,
      "pinCount" : 1
    }
  }, {
    "seq" : 10,
    "timeMs" : 10,
    "type" : "btree.node_visit",
    "operatorId" : "index_scan-1",
    "page" : {
      "fileId" : "title.idx",
      "pageId" : 1
    },
    "btree" : {
      "indexFileId" : "title.idx",
      "nodePageId" : 1,
      "nodeType" : "LEAF"
    }
  }, {
    "seq" : 11,
    "timeMs" : 11,
    "type" : "buffer.hit",
    "page" : {
      "fileId" : "title.idx",
      "pageId" : 1
    },
    "frame" : {
      "frameId" : 1,
      "dirty" : false,
      "pinCount" : 1
    }
  }, {
    "seq" : 12,
    "timeMs" : 12,
    "type" : "btree.node_visit",
    "operatorId" : "index_scan-1",
    "page" : {
      "fileId" : "title.idx",
      "pageId" : 1
    },
    "btree" : {
      "indexFileId" : "title.idx",
      "nodePageId" : 1,
      "nodeType" : "LEAF"
    }
  }, {
    "seq" : 13,
    "timeMs" : 13,
    "type" : "btree.search_end",
    "operatorId" : "index_scan-1"
  }, {
    "seq" : 14,
    "timeMs" : 14,
    "type" : "operator.open",
    "operatorId" : "materialize-1"
  }, {
    "seq" : 15,
    "timeMs" : 15,
    "type" : "operator.open",
    "operatorId" : "selection-1"
  }, {
    "seq" : 16,
    "timeMs" : 16,
    "type" : "operator.open",
    "operatorId" : "scan-1"
  }, {
    "seq" : 17,
    "timeMs" : 17,
    "type" : "buffer.page_load",
    "page" : {
      "fileId" : ".redb-query-e1cda76d-b61c-442e-86a3-d622dc5b10f3-workedon-proj.db",
      "pageId" : 0
    },
    "frame" : {
      "frameId" : 2,
      "dirty" : false,
      "pinCount" : 1
    }
  }, {
    "seq" : 18,
    "timeMs" : 18,
    "type" : "operator.next",
    "operatorId" : "selection-1"
  }, {
    "seq" : 19,
    "timeMs" : 19,
    "type" : "operator.next",
    "operatorId" : "scan-1"
  }, {
    "seq" : 20,
    "timeMs" : 20,
    "type" : "buffer.miss",
    "page" : {
      "fileId" : "workedon.db",
      "pageId" : 0
    }
  }, {
    "seq" : 21,
    "timeMs" : 21,
    "type" : "buffer.page_load",
    "page" : {
      "fileId" : "workedon.db",
      "pageId" : 0
    },
    "frame" : {
      "frameId" : 3,
      "dirty" : false,
      "pinCount" : 1
    }
  }, {
    "seq" : 22,
    "timeMs" : 22,
    "type" : "operator.emit",
    "operatorId" : "scan-1"
  }, {
    "seq" : 23,
    "timeMs" : 23,
    "type" : "operator.emit",
    "operatorId" : "selection-1"
  }, {
    "seq" : 24,
    "timeMs" : 24,
    "type" : "operator.next",
    "operatorId" : "selection-1"
  }, {
    "seq" : 25,
    "timeMs" : 25,
    "type" : "operator.next",
    "operatorId" : "scan-1"
  }, {
    "seq" : 26,
    "timeMs" : 26,
    "type" : "buffer.hit",
    "page" : {
      "fileId" : "workedon.db",
      "pageId" : 0
    },
    "frame" : {
      "frameId" : 3,
      "dirty" : false,
      "pinCount" : 1
    }
  }, {
    "seq" : 27,
    "timeMs" : 27,
    "type" : "operator.emit",
    "operatorId" : "scan-1"
  }, {
    "seq" : 28,
    "timeMs" : 28,
    "type" : "operator.emit",
    "operatorId" : "selection-1"
  }, {
    "seq" : 29,
    "timeMs" : 29,
    "type" : "operator.next",
    "operatorId" : "selection-1"
  }, {
    "seq" : 30,
    "timeMs" : 30,
    "type" : "operator.next",
    "operatorId" : "scan-1"
  }, {
    "seq" : 31,
    "timeMs" : 31,
    "type" : "buffer.hit",
    "page" : {
      "fileId" : "workedon.db",
      "pageId" : 0
    },
    "frame" : {
      "frameId" : 3,
      "dirty" : false,
      "pinCount" : 1
    }
  }, {
    "seq" : 32,
    "timeMs" : 32,
    "type" : "operator.emit",
    "operatorId" : "scan-1"
  }, {
    "seq" : 33,
    "timeMs" : 33,
    "type" : "operator.emit",
    "operatorId" : "selection-1"
  }, {
    "seq" : 34,
    "timeMs" : 34,
    "type" : "operator.next",
    "operatorId" : "selection-1"
  }, {
    "seq" : 35,
    "timeMs" : 35,
    "type" : "operator.next",
    "operatorId" : "scan-1"
  }, {
    "seq" : 36,
    "timeMs" : 36,
    "type" : "buffer.hit",
    "page" : {
      "fileId" : "workedon.db",
      "pageId" : 0
    },
    "frame" : {
      "frameId" : 3,
      "dirty" : false,
      "pinCount" : 1
    }
  }, {
    "seq" : 37,
    "timeMs" : 37,
    "type" : "operator.emit",
    "operatorId" : "scan-1"
  }, {
    "seq" : 38,
    "timeMs" : 38,
    "type" : "operator.next",
    "operatorId" : "scan-1"
  }, {
    "seq" : 39,
    "timeMs" : 39,
    "type" : "buffer.hit",
    "page" : {
      "fileId" : "workedon.db",
      "pageId" : 0
    },
    "frame" : {
      "frameId" : 3,
      "dirty" : false,
      "pinCount" : 1
    }
  }, {
    "seq" : 40,
    "timeMs" : 40,
    "type" : "operator.emit",
    "operatorId" : "scan-1"
  }, {
    "seq" : 41,
    "timeMs" : 41,
    "type" : "operator.emit",
    "operatorId" : "selection-1"
  }, {
    "seq" : 42,
    "timeMs" : 42,
    "type" : "operator.next",
    "operatorId" : "selection-1"
  }, {
    "seq" : 43,
    "timeMs" : 43,
    "type" : "operator.next",
    "operatorId" : "scan-1"
  }, {
    "seq" : 44,
    "timeMs" : 44,
    "type" : "buffer.flush",
    "page" : {
      "fileId" : ".redb-query-e1cda76d-b61c-442e-86a3-d622dc5b10f3-workedon-proj.db",
      "pageId" : 0
    }
  }, {
    "seq" : 45,
    "timeMs" : 45,
    "type" : "operator.close",
    "operatorId" : "scan-1"
  }, {
    "seq" : 46,
    "timeMs" : 46,
    "type" : "operator.close",
    "operatorId" : "selection-1"
  }, {
    "seq" : 47,
    "timeMs" : 47,
    "type" : "operator.next",
    "operatorId" : "index_scan-1"
  }, {
    "seq" : 48,
    "timeMs" : 48,
    "type" : "buffer.miss",
    "page" : {
      "fileId" : "movies.db",
      "pageId" : 0
    }
  }, {
    "seq" : 49,
    "timeMs" : 49,
    "type" : "buffer.page_load",
    "page" : {
      "fileId" : "movies.db",
      "pageId" : 0
    },
    "frame" : {
      "frameId" : 4,
      "dirty" : false,
      "pinCount" : 1
    }
  }, {
    "seq" : 50,
    "timeMs" : 50,
    "type" : "operator.emit",
    "operatorId" : "index_scan-1"
  }, {
    "seq" : 51,
    "timeMs" : 51,
    "type" : "buffer.evict",
    "frame" : {
      "frameId" : 0,
      "dirty" : false,
      "pinCount" : 0,
      "evictedPage" : {
        "fileId" : "title.idx",
        "pageId" : 0
      }
    }
  }, {
    "seq" : 52,
    "timeMs" : 52,